{
 "job_id": "job_4aec75a27fae0844",
 "tool": "compute_shadow",
 "status": "succeeded",
 "created_at": "2026-10-17T19:01:45Z",
 "started_at": "2026-10-17T19:01:45Z",
 "finished_at": "2026-10-17T19:31:03Z",
 "inputs": {
  "baseline_id": "bas_firenze_novoli_20261009",
  "snapshot_ids": [
   "snp_fi_alberi_20261009",
   "snp_fi_dsm2023_20261009",
   "snp_fi_dtm2023_20261009",
   "snp_osm_firenze_20261009",
   "snp_rt_uv_firenze_novoli_20261009"
  ]
 },
 "params": {
  "receivers": [
   {
    "receiver_id": "pth_fi_RC4",
    "kind": "path",
    "geometry": {
     "coordinates": [
      [
       679251.47,
       4851649.29
      ],
      [
       679252.25,
       4851651.08
      ],
      [
       679246.35,
       4851653.65
      ],
      [
       679244.79,
       4851654.34
      ],
      [
       679233.55,
       4851610.68
      ],
      [
       679233.05,
       4851609.15
      ],
      [
       679227.35,
       4851611.62
      ],
      [
       679226.24,
       4851607.36
      ],
      [
       679156.52,
       4851642.75
      ],
      [
       679135.23,
       4851653.56
      ],
      [
       679126.4,
       4851658.03
      ],
      [
       679081.98,
       4851680.58
      ],
      [
       679050.6,
       4851696.5
      ],
      [
       679042.26,
       4851699.98
      ],
      [
       679035.15,
       4851702.94
      ],
      [
       679019.41,
       4851711.88
      ],
      [
       678968.24,
       4851735.67
      ],
      [
       678941.34,
       4851745.83
      ],
      [
       678927.05,
       4851750.83
      ],
      [
       678908.59,
       4851756.3
      ],
      [
       678885.05,
       4851762.52
      ],
      [
       678867.69,
       4851766.47
      ],
      [
       678833.91,
       4851772.26
      ],
      [
       678827.43,
       4851773.28
      ],
      [
       678824.58,
       4851773.42
      ],
      [
       678820.12,
       4851772.88
      ],
      [
       678818.78,
       4851774.51
      ],
      [
       678817.3,
       4851775.99
      ],
      [
       678815.67,
       4851777.34
      ],
      [
       678813.92,
       4851778.5
      ],
      [
       678812.07,
       4851779.51
      ],
      [
       678810.12,
       4851780.31
      ],
      [
       678808.11,
       4851780.94
      ],
      [
       678806.04,
       4851781.36
      ],
      [
       678803.94,
       4851781.59
      ],
      [
       678801.84,
       4851781.6
      ],
      [
       678799.74,
       4851781.43
      ],
      [
       678797.66,
       4851781.04
      ],
      [
       678795.64,
       4851780.45
      ],
      [
       678777.38,
       4851782.61
      ],
      [
       678723.2,
       4851790.2
      ],
      [
       678687.83,
       4851795.6
      ],
      [
       678628.66,
       4851804.11
      ],
      [
       678626.46,
       4851804.58
      ],
      [
       678623.92,
       4851805.37
      ],
      [
       678621.98,
       4851806.03
      ],
      [
       678620.03,
       4851807.17
      ],
      [
       678617.17,
       4851809.59
      ],
      [
       678615.09,
       4851812.78
      ],
      [
       678613.61,
       4851816.8
      ],
      [
       678612.54,
       4851821.05
      ],
      [
       678610.51,
       4851823.42
      ],
      [
       678608.72,
       4851824.5
      ],
      [
       678606.91,
       4851825.34
      ],
      [
       678604.17,
       4851826.37
      ],
      [
       678595.93,
       4851827.9
      ],
      [
       678588.26,
       4851829.05
      ],
      [
       678572.47,
       4851832.15
      ],
      [
       678492.98,
       4851846.44
      ],
      [
       678486.13,
       4851847.67
      ],
      [
       678477.6,
       4851848.93
      ],
      [
       678464.64,
       4851851.17
      ],
      [
       678378.92,
       4851865.19
      ],
      [
       678375.33,
       4851865.25
      ],
      [
       678373.22,
       4851864.37
      ],
      [
       678370.94,
       4851863.03
      ],
      [
       678366.99,
       4851865.32
      ],
      [
       678362.06,
       4851867.68
      ],
      [
       678355.98,
       4851869.06
      ],
      [
       678354.26,
       4851869.11
      ],
      [
       678349.55,
       4851869.21
      ],
      [
       678342.89,
       4851868.18
      ],
      [
       678335.76,
       4851866.32
      ],
      [
       678330.0,
       4851863.85
      ],
      [
       678325.07,
       4851860.17
      ],
      [
       678320.93,
       4851855.49
      ],
      [
       678316.7,
       4851852.42
      ],
      [
       678311.31,
       4851850.02
      ],
      [
       678305.38,
       4851849.64
      ],
      [
       678298.46,
       4851849.94
      ],
      [
       678293.14,
       4851851.24
      ],
      [
       678289.49,
       4851852.47
      ],
      [
       678289.81,
       4851849.18
      ],
      [
       678289.83,
       4851848.93
      ],
      [
       678289.83,
       4851848.92
      ],
      [
       678289.53,
       4851848.9
      ]
     ],
     "type": "LineString"
    }
   }
  ],
  "when": {
   "date": "2026-09-15",
   "timezone": "Europe/Rome",
   "times": [
    "08:00",
    "08:30",
    "09:00",
    "09:30",
    "10:00",
    "10:30",
    "11:00",
    "11:30",
    "12:00",
    "12:30",
    "13:00",
    "13:30",
    "14:00",
    "14:30",
    "15:00",
    "15:30",
    "16:00",
    "16:30",
    "17:00",
    "17:30",
    "18:00",
    "18:30",
    "19:00"
   ]
  },
  "method": {
   "name": "geometric_ray",
   "space_step_m": 1.0,
   "time_step_min": 5.0,
   "obstacles": "buildings_and_trees"
  },
  "walk_speed_m_s": 1.2,
  "casi": [
   "base",
   "base_h_min",
   "base_h_max",
   "alberi_min",
   "alberi_tipico",
   "alberi_max",
   "veg_lidar_min",
   "veg_lidar_tipico",
   "veg_lidar_max"
  ],
  "fasce": [
   {
    "id": "punta_12_30_13_30",
    "from": "12:30",
    "to": "13:30"
   },
   {
    "id": "giornata_8_19",
    "from": "08:00",
    "to": "19:00"
   }
  ],
  "el_min_deg": 5.0,
  "sun_reference_lonlat": [
   11.226,
   43.798
  ],
  "geometrie_sha256": "8ba7121c26e9d9e5872c55ed2bc66177861ccfd033129967d90f26d8d5538c90",
  "chiome": {
   "forma": "ellissoide",
   "tronco": "trascurato",
   "parametri": "colonne h, chioma_d, imposta (e min/max) del layer alberi di geometrie_firenze_novoli.gpkg"
  },
  "sospesi": "coperture OSM (building=roof) sospese, base = tetto - 0,4 m (0,2-0,8 m) come scene/build.py; portici ignoti trattati come pieni",
  "demolizioni": "volumi con presente_2023 falso (demolizione probabile da LiDAR 2023) esclusi",
  "method_version": "0.3.0",
  "vegetazione_lidar": {
   "forma": "prisma opaco sull'impronta del cluster",
   "z_hi": "h95 del CHM nel cluster",
   "z_lo_frazione_di_h95": {
    "veg_lidar_min": 0.4,
    "veg_lidar_tipico": 0.25,
    "veg_lidar_max": 0.15
   },
   "esclusi": "cluster liscia (probabili tetti non mappati)",
   "poligoni_sha256": "7539e722d1c5e420395402f3f31126fca7f97faa8cc08ad86bd6db664b3a6998"
  }
 },
 "limits": {
  "max_area_km2": 4,
  "max_rows": 50000,
  "max_seconds": 3600,
  "max_memory_mb": 4096
 },
 "progress": {
  "fraction": 1.0,
  "message": "completato"
 },
 "result_manifest_id": "man_4aec75a27fae0844"
}