{
 "job_id": "job_abb376dcab1e8361",
 "tool": "compute_shadow",
 "status": "succeeded",
 "created_at": "2026-10-10T12:40:59Z",
 "started_at": "2026-10-10T12:40:59Z",
 "finished_at": "2026-10-10T12:41:00Z",
 "inputs": {
  "baseline_id": "bas_firenze_novoli_20261009",
  "snapshot_ids": [
   "snp_fi_dsm2023_20261009",
   "snp_fi_dtm2023_20261009",
   "snp_osm_firenze_20261009",
   "snp_rt_uv_firenze_novoli_20261009"
  ]
 },
 "params": {
  "receivers": [
   {
    "receiver_id": "pth_fi_R01",
    "kind": "path",
    "geometry": {
     "coordinates": [
      [
       679141.91,
       4851036.28
      ],
      [
       679144.19,
       4851040.29
      ],
      [
       679144.18,
       4851040.3
      ],
      [
       679145.78,
       4851039.39
      ],
      [
       679149.21,
       4851047.82
      ],
      [
       679150.34,
       4851049.08
      ],
      [
       679152.57,
       4851051.79
      ],
      [
       679165.21,
       4851067.15
      ],
      [
       679180.43,
       4851085.64
      ],
      [
       679186.27,
       4851092.69
      ],
      [
       679207.53,
       4851114.78
      ],
      [
       679211.67,
       4851119.05
      ],
      [
       679216.02,
       4851123.99
      ],
      [
       679221.94,
       4851130.92
      ],
      [
       679222.9,
       4851131.98
      ],
      [
       679235.62,
       4851146.12
      ],
      [
       679239.4,
       4851150.28
      ],
      [
       679241.85,
       4851153.71
      ],
      [
       679255.69,
       4851174.38
      ],
      [
       679261.68,
       4851183.81
      ],
      [
       679265.68,
       4851189.97
      ],
      [
       679270.19,
       4851198.03
      ],
      [
       679282.84,
       4851230.9
      ],
      [
       679284.63,
       4851235.55
      ],
      [
       679286.96,
       4851241.54
      ],
      [
       679290.24,
       4851242.8
      ],
      [
       679293.05,
       4851242.48
      ],
      [
       679293.36,
       4851243.86
      ],
      [
       679372.46,
       4851223.0
      ],
      [
       679400.17,
       4851215.46
      ],
      [
       679400.4,
       4851216.18
      ],
      [
       679407.42,
       4851238.33
      ],
      [
       679406.01,
       4851255.68
      ],
      [
       679392.69,
       4851254.78
      ]
     ],
     "type": "LineString"
    }
   }
  ],
  "when": {
   "date": "2026-10-25",
   "timezone": "Europe/Rome",
   "times": [
    "14:30"
   ]
  },
  "method": {
   "name": "geometric_ray",
   "space_step_m": 1,
   "time_step_min": 5,
   "obstacles": "documented_buildings_only"
  },
  "walk_speed_m_s": 1.2,
  "casi": [
   "base",
   "base_h_min",
   "base_h_max"
  ],
  "fasce": [],
  "el_min_deg": 5.0,
  "sun_reference_lonlat": [
   11.226,
   43.798
  ],
  "geometrie_sha256": "8ba7121c26e9d9e5872c55ed2bc66177861ccfd033129967d90f26d8d5538c90",
  "chiome": {
   "forma": "ellissoide",
   "tronco": "trascurato",
   "parametri": "colonne h, chioma_d, imposta (e min/max) del layer alberi di geometrie_firenze_novoli.gpkg"
  },
  "sospesi": "coperture OSM (building=roof) sospese, base = tetto - 0,4 m (0,2-0,8 m) come scene/build.py; portici ignoti trattati come pieni",
  "demolizioni": "volumi con presente_2023 falso (demolizione probabile da LiDAR 2023) esclusi",
  "method_version": "0.3.0"
 },
 "limits": {
  "max_area_km2": 4,
  "max_rows": 50000,
  "max_seconds": 3600,
  "max_memory_mb": 4096
 },
 "progress": {
  "fraction": 1.0,
  "message": "completato"
 },
 "result_manifest_id": "man_abb376dcab1e8361"
}