{
 "job_id": "job_3dffcc2683e3bb67",
 "tool": "compute_walk_access",
 "status": "rejected_limits",
 "created_at": "2026-10-02T08:05:00Z",
 "inputs": {
  "baseline_id": "bas_z2_20261001",
  "snapshot_ids": [
   "snp_gtfs_at_toscana_20261001",
   "snp_osm_pisa_20261001",
   "snp_rt_unita_volumetriche_20261001"
  ]
 },
 "params": {
  "destination_ids": [
   "dst_school_piee82101p"
  ],
  "origins": {
   "kind": "grid",
   "aoi_id": "aoi_z2",
   "spacing_m": 5
  },
  "profile": {
   "speed_m_s": 1.2
  },
  "thresholds_min": [
   10
  ]
 },
 "limits": {
  "max_area_km2": 4,
  "max_rows": 50000,
  "max_seconds": 600,
  "max_memory_mb": 4096
 },
 "error": {
  "code": "limit_exceeded",
  "message": "Griglia a 5 m su aoi_z2: circa 160.000 origini, il limite è 50.000.",
  "smaller_request": {
   "origins": {
    "kind": "grid",
    "aoi_id": "aoi_z2",
    "spacing_m": 10
   }
  }
 }
}
