{
 "job_id": "job_e75df500a3191354",
 "tool": "compute_walk_access",
 "status": "succeeded",
 "created_at": "2026-10-01T16:55:02Z",
 "started_at": "2026-10-01T16:55:02Z",
 "finished_at": "2026-10-01T16:55:02Z",
 "inputs": {
  "baseline_id": "bas_z2_20261001",
  "snapshot_ids": [
   "snp_osm_pisa_20261001",
   "snp_sit_civici_20261001"
  ]
 },
 "params": {
  "destination_ids": [
   "dst_school_piee82101p"
  ],
  "entrance_ids": [
   "ent_osm_n6532183886"
  ],
  "origins": {
   "kind": "civici_sit_z2",
   "count": 2224
  },
  "profile": {
   "speed_m_s": 0.8,
   "crossing_penalty_s": 0,
   "stairs": "allowed",
   "snap_limit_m": 40.0
  },
  "thresholds_min": [
   5.0,
   10.0,
   15.0
  ],
  "deviazione_alta": {
   "ratio": 1.5,
   "min_diretta_m": 100
  },
  "method_version": "0.1.0",
  "graph": {
   "graph_id": "grf_z2_osm_20261001",
   "graph_sha256": "7fffadd58fb079da33b617b987fd14553027889050d753eec86e1177bb087be7",
   "regole_sha256": "7334ecafeafe39ede0654d6cbde541ca0c2c7380c9098a21b3b6c81fd6e8eec3"
  }
 },
 "limits": {
  "max_area_km2": 4,
  "max_rows": 50000,
  "max_seconds": 600,
  "max_memory_mb": 4096
 },
 "progress": {
  "fraction": 1.0,
  "message": "completato"
 },
 "result_manifest_id": "man_e75df500a3191354"
}