{
 "job_id": "job_9f699200363c4cf0",
 "tool": "compare_scenarios",
 "status": "succeeded",
 "created_at": "2026-10-10T11:21:28Z",
 "started_at": "2026-10-10T11:21:28Z",
 "finished_at": "2026-10-10T11:21:31Z",
 "inputs": {
  "baseline_id": "bas_firenze_novoli_20261009",
  "snapshot_ids": [
   "snp_cm_edscol_firenze_20261009",
   "snp_fi_alberi_20261009",
   "snp_fi_barriere_20261009",
   "snp_fi_civici_20261009",
   "snp_fi_dsm2023_20261009",
   "snp_fi_dtm2023_20261009",
   "snp_fi_rifugi_aree_20261009",
   "snp_fi_rifugi_biblioteche_20261009",
   "snp_fi_scuole_statali_20261009",
   "snp_fi_tram_fermate_20261009",
   "snp_gtfs_at_firenze_20261009",
   "snp_gtfs_gest_firenze_20261009",
   "snp_osm_firenze_20261009",
   "snp_rt_uv_firenze_novoli_20261009"
  ]
 },
 "params": {
  "scenario_ids": [
   "scn_fi_s2_pensilina_attesa_polo"
  ],
  "scenario_sha256": [
   "0106b04b2cb05639d2165df369d1a96d95faac2f9fecfe066af42a25c50232a4"
  ],
  "with_variants": true,
  "context": "con_vegetazione_lidar",
  "method_version": "0.2.0",
  "ombre_version": "0.3.0",
  "baseline_record_sha256": "0887f5c6b5806be7d2fb1d3dee6eab580d2508961f8ad4a769aea57a8976cb91"
 },
 "limits": {
  "max_area_km2": 4,
  "max_rows": 50000,
  "max_seconds": 3600,
  "max_memory_mb": 4096
 },
 "progress": {
  "fraction": 1.0,
  "message": "completato"
 },
 "result_manifest_id": "man_9f699200363c4cf0"
}